{
  "id": "inspect-ai",
  "name": "Inspect AI",
  "kind": "framework",
  "maintainer": "UK AI Security Institute",
  "released": "2024-04",
  "description": "Open-source evaluation framework from the UK AI Security Institute. Evals are Python tasks composed of a dataset, solvers (prompting, tool use, multi-turn agents, sandboxes) and scorers (exact match, model-graded, custom), with a log viewer for inspecting every sample. The companion inspect_evals package ships 200+ ready-to-run evals. Results are self-run by whoever executes the task; Inspect is also the engine behind Epoch AI's and lighteval's evaluations, so many published third-party numbers trace back to it.",
  "description_zh": "英国 AI 安全研究所的开源评估框架。评估以 Python 任务形式编写,由数据集、求解器(提示、工具使用、多轮智能体、沙盒)和评分器(精确匹配、模型评分、自定义)组成,并提供可检视每个样本的日志查看器。配套的 inspect_evals 包提供 200 多个即用评估。结果由执行任务者自行运行得出;Inspect 也是 Epoch AI 和 lighteval 评估背后的引擎,因此许多已发布的第三方数据都可追溯至它。",
  "status": "active",
  "license": "MIT",
  "benchmarks": [
    "mmlu",
    "mmlu-pro",
    "gpqa-diamond",
    "hle",
    "aime-2025",
    "humaneval",
    "mbpp",
    "gsm8k",
    "math",
    "hellaswag",
    "bbh",
    "ifeval",
    "simpleqa",
    "mmmu",
    "drop",
    "winogrande",
    "truthfulqa",
    "bfcl",
    "swe-bench-verified",
    "gaia",
    "osworld",
    "agentbench",
    "tau2-bench",
    "browsecomp",
    "mle-bench",
    "paperbench"
  ],
  "methodology": "self-run",
  "links": {
    "website": "https://inspect.aisi.org.uk/",
    "repo": "https://github.com/UKGovernmentBEIS/inspect_ai",
    "paper": null
  },
  "notes": "First PyPI release inspect-ai 0.0.1 on 2024-04-03 (repo created 2023-11). Benchmark list is from the inspect_evals README (UKGovernmentBEIS/inspect_evals): mmlu, mmlu_pro, gpqa_diamond, hle, aime2025, humaneval, mbpp, gsm8k, math, hellaswag, bbh, ifeval, simpleqa, mmmu, drop, winogrande, truthfulqa, bfcl, swe_bench (SWE-bench Verified), gaia, osworld, agent_bench_os, tau2, browse_comp, mle_bench, paperbench (marked work in progress)."
}
