{
  "id": "artificial-analysis",
  "name": "Artificial Analysis",
  "kind": "independent-evaluator",
  "maintainer": "Artificial Analysis",
  "released": "2024-01",
  "description": "Independent benchmarking company that self-runs a fixed suite of evaluations against every major model and API endpoint under identical zero-shot prompts, temperature and repeat settings, and publishes an Intelligence Index alongside speed, latency and price. Answers are scored by regex extraction, code execution or an LLM equality checker; agentic evals run in its open-source Stirrup harness. Labs do not pay for placement and a 'mystery shopper' policy re-tests public endpoints, which makes it a useful cross-lab reference for otherwise self-reported numbers.",
  "description_zh": "独立基准测试公司,在完全相同的零样本提示、温度和重复设置下,对每个主要模型和 API 端点自行运行一套固定评估,并发布 Intelligence Index 以及速度、延迟和价格。答案通过正则提取、代码执行或 LLM 等价检查器评分;智能体评估在其开源 Stirrup 框架中运行。实验室不为排名付费,且\"神秘顾客\"政策会对公开端点进行复测,使其成为对照各家自报数据的有用跨实验室参考。",
  "status": "active",
  "license": null,
  "benchmarks": [
    "gpqa-diamond",
    "hle",
    "mmlu-pro",
    "aime-2025",
    "livecodebench",
    "mmmu-pro",
    "terminal-bench",
    "tau2-bench"
  ],
  "methodology": "self-run",
  "links": {
    "website": "https://artificialanalysis.ai",
    "repo": "https://github.com/ArtificialAnalysis/Stirrup",
    "paper": null
  },
  "notes": "Public launch January 2024 (co-founders on Latent Space, 2026-01-08). Benchmarks from artificialanalysis.ai/methodology/intelligence-benchmarking (Index v4.1.1: GPQA Diamond, HLE, Terminal-Bench 2.1; additional: MMMU Pro; legacy: tau2-Bench Telecom, MMLU-Pro, AIME 2025, LiveCodeBench). MATH-500 is a subset and not listed as `math`."
}
