{
  "id": "open-llm-leaderboard",
  "name": "Open LLM Leaderboard",
  "kind": "leaderboard",
  "maintainer": "Hugging Face",
  "released": "2023-04",
  "description": "Hugging Face's leaderboard for open-weight models. Anyone could submit a Hub checkpoint and it was evaluated automatically with a pinned lm-evaluation-harness version on identical prompts (v1: ARC, HellaSwag, MMLU, TruthfulQA, WinoGrande, GSM8K; v2 from June 2024: IFEval, BBH, MATH level 5, GPQA, MuSR, MMLU-Pro). It made reproducible, like-for-like comparison of thousands of open models possible, then saturated and was retired in March 2025.",
  "description_zh": "Hugging Face 面向开放权重模型的排行榜。任何人都可提交 Hub 检查点,系统会用固定版本的 lm-evaluation-harness 在相同提示下自动评估(v1:ARC、HellaSwag、MMLU、TruthfulQA、WinoGrande、GSM8K;2024 年 6 月起的 v2:IFEval、BBH、MATH level 5、GPQA、MuSR、MMLU-Pro)。它使数千个开放模型的可复现、同等条件比较成为可能,随后趋于饱和并于 2025 年 3 月退役。",
  "status": "archived",
  "license": "Apache-2.0",
  "benchmarks": [
    "hellaswag",
    "mmlu",
    "truthfulqa",
    "winogrande",
    "gsm8k",
    "ifeval",
    "bbh",
    "math",
    "gpqa-diamond",
    "mmlu-pro"
  ],
  "methodology": "submission",
  "links": {
    "website": "https://huggingface.co/spaces/open-llm-leaderboard/open_llm_leaderboard",
    "repo": null,
    "paper": null
  },
  "notes": "Space created 2023-04-17. v1 archived June 2024 (huggingface.co/docs/leaderboards/en/open_llm_leaderboard/archive); v2 stopped accepting submissions in March 2025 and Hugging Face lists it under 'Archived Open LLM Leaderboard (2024-2025)'. The Space still renders the final table. GPQA was run on all subsets; MATH used the level-5 subset only."
}
